{
  "schema_version": 2,
  "recorded_at": "2026-08-30T03:59:24.268122Z",
  "agent": "claude",
  "agent_version": "2.1.251 (Claude Code)",
  "host": "direct",
  "terminal": {
    "rows": 30,
    "columns": 48,
    "term": "xterm-256color",
    "herdr_env": false
  },
  "provenance": {
    "path": "direct_pty",
    "controlling_tty": true,
    "isolated_session": false
  },
  "probe": "HTP_A אבגדה HTP_B 0123456789 abcDEF HTP_C וזחטי HTP_D",
  "events": [
    {
      "kind": "resize",
      "elapsed_ms": 0,
      "rows": 30,
      "columns": 48
    },
    {
      "kind": "input",
      "elapsed_ms": 5086,
      "text": "HTP_A אבגדה HTP_B 0123456789 abcDEF HTP_C וזחטי HTP_D",
      "submitted": false
    }
  ],
  "observed": {
    "probe_fragments": [
      "HTP_A הדגבא HTP_B 0123456789 abcDEF HTP_C",
      "HTP_D יטחזו"
    ],
    "source": "reconstructed_terminal_rows"
  },
  "classification": {
    "order": "visual",
    "wrapping": "post_bidi",
    "evidence": [
      "both Hebrew sentinel runs observed in visual order",
      "probe was not observed as one paint fragment at 48 columns"
    ]
  }
}
