{
  "schema_version": 2,
  "recorded_at": "2026-08-30T04:11:29.140869Z",
  "agent": "claude",
  "agent_version": "2.1.251 (Claude Code)",
  "host": "herdr",
  "terminal": {
    "rows": 30,
    "columns": 80,
    "term": "xterm-256color",
    "herdr_env": true
  },
  "provenance": {
    "path": "herdr_outer_screen",
    "controlling_tty": true,
    "isolated_session": true,
    "herdr_version": "herdr 0.8.2",
    "session_verified": true,
    "pane_verified": true,
    "agent_process_verified": true
  },
  "probe": "HTP_A אבגדה HTP_B 0123456789 abcDEF HTP_C וזחטי HTP_D",
  "events": [
    {
      "kind": "resize",
      "elapsed_ms": 0,
      "rows": 30,
      "columns": 80
    },
    {
      "kind": "agent_launch",
      "elapsed_ms": 2068
    },
    {
      "kind": "input",
      "elapsed_ms": 10084,
      "text": "HTP_A אבגדה HTP_B 0123456789 abcDEF HTP_C וזחטי HTP_D",
      "submitted": false
    }
  ],
  "observed": {
    "probe_fragments": [
      "HTP_A הדגבא HTP_B 0123456789 abcDEF HTP_C יטחזו",
      "HTP_D"
    ],
    "source": "reconstructed_terminal_rows"
  },
  "classification": {
    "order": "visual",
    "wrapping": "not_observed",
    "evidence": [
      "Hebrew order by reconstructed row: row 1=visual",
      "wrapping was not exercised because the 53-column probe fits at 80 columns"
    ]
  }
}
