{
  "schema_version": 2,
  "recorded_at": "2026-08-30T03:59:31.385423Z",
  "agent": "claude",
  "agent_version": "2.1.251 (Claude Code)",
  "host": "direct",
  "terminal": {
    "rows": 30,
    "columns": 80,
    "term": "xterm-256color",
    "herdr_env": false
  },
  "provenance": {
    "path": "direct_pty",
    "controlling_tty": true,
    "isolated_session": false
  },
  "probe": "HTP_A אבגדה HTP_B 0123456789 abcDEF HTP_C וזחטי HTP_D",
  "events": [
    {
      "kind": "resize",
      "elapsed_ms": 0,
      "rows": 30,
      "columns": 80
    },
    {
      "kind": "input",
      "elapsed_ms": 5082,
      "text": "HTP_A אבגדה HTP_B 0123456789 abcDEF HTP_C וזחטי HTP_D",
      "submitted": false
    }
  ],
  "observed": {
    "probe_fragments": [
      "HTP_A הדגבא HTP_B 0123456789 abcDEF HTP_C יטחזו HTP_D"
    ],
    "source": "reconstructed_terminal_rows"
  },
  "classification": {
    "order": "visual",
    "wrapping": "not_observed",
    "evidence": [
      "both Hebrew sentinel runs observed in visual order",
      "wrapping was not exercised because the 53-column probe fits at 80 columns"
    ]
  }
}
